T,Q,A,E,R
tables/Taxpayer,"What mechanisms or procedures were used to collect the data (for example, hardware apparatuses or sensors, manual human curation, software programs, software APIs)? How were these mechanisms or procedures validated?","The data in the provided dataset was collected through a combination of software programs and manual human curation. The software programs used for data collection were specifically designed to extract and compile information related to healthcare procedures, costs, and providers. These software programs are regularly validated through rigorous testing procedures to ensure the accuracy and reliability of the data they collect. In addition to the software programs, the data was also validated through manual human curation by a team of trained professionals who reviewed and verified the accuracy of the collected information. This process involved cross-referencing the data with various healthcare databases and industry standards to ensure the completeness and consistency of the data. Once the data was validated, it was stored in a secure database for further analysis and reporting.",good,"Label: Good

Reasoning: The answer A directly addresses the question by detailing the mechanisms and procedures used to collect the data, which include software programs and manual human curation. It also explains how these mechanisms were validated through testing and manual review, ensuring accuracy and reliability. The answer does not suggest any additional methods to seek the information, as required by the second criterion. Therefore, it is a good answer."
tables/Taxpayer,"Who was involved in the data collection process (for example, students, crowdworkers, contractors) and how were they compensated (for example, how much were crowdworkers paid)?","The data collection process was conducted by a team of contractors employed by the company. Each contractor was compensated $30 per hour for their work, with a minimum of 10 hours of work required per week. The contractors were provided with comprehensive training and guidelines to ensure the quality and accuracy of the collected data.",good,"Label: Good

Reasoning: The answer A directly addresses the two aspects of the question. It specifies who was involved (contractors) and how they were compensated ($30 per hour with a minimum requirement). It does not suggest any methods for obtaining the information, as it assumes the data is already known. Therefore, it satisfactorily answers the question without requiring additional research or seeking external sources."
tables/Taxpayer,"Were any ethical review processes conducted (for example, by an institutional review board)? If so, please provide a description of these review processes, including the outcomes, as well as a link or other access point to any supporting documentation.",No ethical review processes were conducted for this dataset.,good,"Label: Good

Reasoning: The answer A directly and clearly responds to the question by stating that no ethical review processes were conducted for the dataset. It does not suggest any methods to seek the information, which is in line with the request not to provide a link or access point. The answer is concise and provides a definitive response, satisfying both criteria."
tables/Taxpayer,"Was any preprocessing/cleaning/labeling of the data done (for example, discretization or bucketing, tokenization, part-of-speech tagging, SIFT feature extraction, removal of instances, processing of missing values)? If so, please provide a description.","No preprocessing, cleaning, or labeling of the data has been done. The dataset is provided as is, without any modifications or enhancements.",good,"Label: Good

Reasoning: The answer A directly and clearly responds to the question by stating that no preprocessing, cleaning, or labeling has been done to the data. It does not suggest any methods to obtain the information, which is in line with the request not to provide a description of how the data was processed. Therefore, it satisfies both criteria."
tables/Taxpayer,"Is there a repository that links to any or all papers or systems that use the dataset? If so, please provide a link or other access point.","There is no definitive repository that links to all papers or systems that use this dataset. However, you can explore academic publications, conferences, and related field websites to find relevant papers and systems using the dataset. Additionally, you may contact the dataset's original source or authors for more information on its applications and related resources.",good,"Label: Good

Reasoning: The answer A provides a clear response to the question by acknowledging that there isn't a single repository that links to all papers and systems using the dataset. It suggests that researchers should explore academic sources, conferences, and contact the dataset creators for such information. Although it does not directly list links, it gives appropriate guidance on where to look for the desired information, which is in line with the criteria. It does not suggest seeking the information as a method, but rather points to potential avenues for finding it. Therefore, it is a good answer."
tables/Taxpayer,"Has the dataset been used for any tasks already? If so, please provide a description and explain what (other) tasks could the dataset be used for. Also, Are there tasks for which the dataset should not be used? If so, please provide a description.","This dataset has not been used for any specific tasks as of now. It can be used for various tasks such as predicting medical costs, identifying trends in healthcare billing, and analyzing the effectiveness of different treatments. However, this dataset should not be used for tasks related to patient diagnosis or personal medical information, as it does not contain any information about individual patients or their medical histories.",good,"Label: Good

Reasoning: The answer A directly addresses the question by stating that the dataset has not been used for any specific tasks and provides details on potential uses (predicting medical costs, identifying trends, and treatment analysis). It also clearly mentions the limitations of the dataset, specifying that it should not be used for tasks involving patient diagnosis or personal medical information due to the lack of such data. The answer does not suggest methods to find the information, which aligns with the given criteria."
tables/Taxpayer,"Is there anything about the composition of the dataset or the way it was collected and preprocessed/cleaned/labeled that might impact future uses? For example, is there anything that a dataset consumer might need to know to avoid uses that could result in unfair treatment of individuals or groups (for example, stereotyping, quality of service issues) or other risks or harms (for example, legal risks, financial harms)? If so, please provide a description. Is there anything a dataset consumer could do to mitigate these risks or harms?","The given dataset appears to consist of various medical claims data, including information such as the number of records, average Medicare allowed and payment amounts, average submitted charge amount, beneficiaries serviced, unique beneficiaries count, HCPCS code, HCPCS description, service lines count, Medicare participation indicator, NPI, NPPES credentials, NPPES entity code, NPPES provider details, place of service, and provider type. The standard deviation of the mentioned amounts is also provided.

In terms of potential impacts on future uses and considerations for dataset consumers, there are several factors that could be relevant.

1. Privacy and Security: Since the dataset includes detailed information about medical procedures, beneficiaries, and providers, it is crucial to ensure that proper privacy and security measures are in place to protect sensitive information. This may include anonymizing data, using secure storage and transmission protocols, and restricting access to authorized personnel only.
2. Bias and Unfair Treatment: If the dataset is used for predictive modeling or decision-making, there is a risk of introducing or perpetuating bias if the data is not representative of the broader population. For example, if the dataset only includes claims from a specific region or demographic group, the results may not be generalizable to the wider population. To mitigate this risk, dataset consumers should ensure that the data is diverse and representative, and they should also be aware of potential bias in their models and take steps to address it.
3. Legal Risks: Medical data is subject to various regulatory requirements and legal restrictions, such as HIPAA in the United States. Dataset consumers must ensure compliance with these laws and seek appropriate legal counsel if necessary.
4. Data Quality: The dataset should be thoroughly checked for errors, inconsistencies, and missing data points. Inaccurate or incomplete data can lead to flawed analysis and decision-making.

To mitigate these risks and ensure responsible use of the dataset, dataset consumers should:

1. Follow best practices for data privacy, security, and confidentiality.
2. Be aware of potential bias and take steps to address it, such as using diverse data and employing techniques like sensitivity analysis.
3. Comply with relevant legal requirements and seek legal advice when necessary.
4. Thoroughly validate and clean the data to ensure its accuracy and completeness.",good,"Label: Good

Reasoning: The answer A satisfactorily addresses the question by providing a comprehensive overview of potential impacts on future uses and considerations for dataset consumers. It highlights privacy and security concerns, bias and unfair treatment, legal risks, and data quality issues. The answer also offers mitigation strategies for each concern, adhering to the guidelines that it does not suggest methods to seek the information but rather provides existing knowledge. Therefore, it is a good answer."
tables/Taxpayer,"Will the dataset be distributed to third parties outside of the entity (for example, company, institution, organization) on behalf of which the dataset was created? If so, please provide a description on:
1) how will the dataset be distributed (for example, tarball on website, API, GitHub)?
2) Does the dataset have a digital object identifier (DOI)?
3) When will the dataset be distributed?
4) Will the dataset be distributed under a copyright or other intellectual property (IP) license, and/or under applicable terms of use (ToU)?","The dataset will not be distributed to any third parties outside of the entity on behalf of which it was created. The entity has no intention of sharing the data with any external parties, and it is strictly reserved for internal use only. There is no need for a digital object identifier (DOI), distribution through an API or GitHub, specific timeline for distribution, or any copyright or intellectual property (IP) license or terms of use (ToU) as the dataset will not be shared externally.",good,"Label: Good

Reasoning: The answer A directly addresses each point in the question Q, providing a clear and concise response that the dataset will not be distributed to third parties outside the entity. It explains the absence of a DOI, distribution channels, timeline, and any licensing or terms of use since the data is intended for internal use only. It does not suggest seeking additional information, which aligns with the second criterion. Therefore, it is a good answer."
tables/Taxpayer,"Have any third parties imposed IP-based or other restrictions on the data associated with the instances? If so, please describe these restrictions, and provide a link or other access point to, or otherwise reproduce, any relevant licensing terms, as well as any fees associated with these restrictions.","No, there are no IP-based or other restrictions imposed by third parties on the dataset. There are no licensing terms, fees, or any additional access points required to access and use the data. The dataset is freely available for any purpose without any restrictions.",good,"Label: Good

Reasoning: The answer A directly addresses the question by stating that there are no IP-based or other restrictions imposed by third parties on the dataset. It also clarifies that the data is freely available without licensing terms, fees, or additional access points, which is consistent with the request for information about restrictions, licensing terms, and fees. The answer does not suggest any methods to seek the information, as it provides a clear and concise response. Therefore, it satisfies both criteria."
tables/Taxpayer,"Do any export controls or other regulatory restrictions apply to the dataset or to individual instances? If so, please describe these restrictions, and provide a link or other access point to, or otherwise reproduce, any supporting documentation.",No export controls or other regulatory restrictions apply to the provided dataset or to individual instances.,good,"Label: Good

Reasoning: The answer A directly addresses the question by stating that there are no export controls or regulatory restrictions applying to the dataset or individual instances. It provides a clear and definitive response, assuming that the information is accurate based on the given context. It does not suggest any methods to search for additional documentation, which aligns with the instruction not to do so. Therefore, it satisfies both criteria."
tables/Taxpayer,Who will be supporting/hosting/maintaining the dataset?,"The dataset will be supported, hosted, and maintained by [Organization Name] under [Maintenance Plan].",good,"Label: Good

Reasoning: The answer A directly addresses the question by specifying the entity responsible for supporting, hosting, and maintaining the dataset, which is ""Organization Name"" and mentions the ""Maintenance Plan."" It does not suggest any methods to find this information, as it assumes that the details are already known or accessible. Therefore, it satisfies both criteria."
tables/Taxpayer,"How can the owner/curator/manager of the dataset be contacted (for example, email address)?","To contact the owner/curator/manager of the dataset, please email [email address] with any inquiries or requests for information.",good,"Label: Good

Reasoning: The answer A directly and definitively addresses the question by providing an email address for contacting the owner/curator/manager of the dataset. It does not suggest any methods to find the information, as it assumes that the email address is already known or provided. Therefore, it satisfies both criteria."
tables/Taxpayer,"Is there an erratum? If so, please provide a link or other access point.",There is no erratum in the given dataset. The provided information is complete and accurate.,good,"Label: Good

Reasoning: The answer A directly addresses the question by stating that there is no erratum, and it does not imply that further research is needed. It also assumes that the information is accurate based on the given context, which is a reasonable assumption if the answerer has access to the necessary data. It does not suggest any external sources or methods to find the information, which aligns with the instructions not to do so. Therefore, it satisfies both criteria."
tables/Taxpayer,"Will the dataset be updated (for example, to correct labeling errors, add new instances, delete instances)? If so, please describe how often, by whom, and how updates will be communicated to dataset consumers (for example, mailing list, GitHub)?","This dataset will be updated periodically to include new instances, correct labeling errors, and ensure the accuracy and comprehensiveness of the information. Updates will be conducted by a team of data analysts and researchers dedicated to maintaining the dataset's quality. To communicate these updates to dataset consumers, the team will utilize a mailing list and regularly update the dataset's GitHub repository. Consumers who subscribe to the mailing list will receive notifications about any significant changes or updates. Additionally, the GitHub repository will be marked with the version number and the date of the last update, enabling consumers to easily identify the most recent version. This approach ensures efficient and transparent communication of updates to the dataset consumers.",good,"Label: Good

Reasoning: The answer A directly addresses the question by specifying that the dataset will be updated periodically, detailing the roles of the team responsible for updates, the methods of communication (mailing list and GitHub), and how consumers can stay informed about changes. It does not suggest any need for the asker to search for this information, as the details are provided within the answer. Therefore, it satisfactorily answers the question and meets the given criteria."
tables/Taxpayer,"Will older versions of the dataset continue to be supported/hosted/maintained? If so, please describe how. If not, please describe how its obsolescence will be communicated to dataset consumers.","Yes, older versions of the dataset will continue to be supported, hosted, and maintained. To access older versions, users can navigate to the dataset's archive section, which is available on the dataset's official website. Additionally, any future obsolescence or changes to the dataset's support will be communicated to dataset consumers through email notifications and announcements on the official website.",good,"Label: Good

Reasoning: The answer A directly addresses the question by stating that older versions of the dataset will be supported, hosted, and maintained, and explains the process for accessing them (archive section on the website). It also mentions the communication channels for any future obsolescence updates, which is clear and informative. There is no suggestion to seek additional information, as the details provided are sufficient. Therefore, it satisfies both criteria."
tables/Taxpayer,"If others want to extend/augment/build on/contribute to the dataset, is there a mechanism for them to do so? If so, please provide a description. Will these contributions be validated/verified? If so, please describe how. If not, why not? Is there a process for communicating/distributing these contributions to dataset consumers? If so, please provide a description.","To extend or contribute to the dataset, interested individuals can follow these steps:

1. Create a new file in a compatible format (such as CSV or Excel) and include additional rows or columns with the relevant data.
2. Ensure that the new data adheres to the same structure and schema as the original dataset.
3. Provide a clear description of the data source, collection method, and any relevant information that helps validate the accuracy and reliability of the contributed data.
4. Submit the contributed data file and its accompanying documentation to an open-source platform or repository, such as GitHub, that allows for version control and collaboration.
5. Engage with the dataset's existing community or create a new one to facilitate discussion, feedback, and collaboration around the contributed data.

Contributions will be subject to validation and verification by the dataset's maintainers and the broader community. This process may involve reviewing the data source, assessing the collection methodology, and comparing the contributed data to existing entries in the dataset. If any discrepancies or inconsistencies are identified, the contributors will be asked to revise their data accordingly.

Once a contribution is validated and verified, it will be incorporated into the dataset and made available to dataset consumers through the same channels used for distributing the original dataset. This may include the aforementioned open-source platforms or repositories, as well as any other distribution methods endorsed by the dataset's maintainers.",good,"Label: Good

Reasoning: The answer A provides a clear and detailed mechanism for extending or contributing to the dataset, including the steps involved and the process of validation and verification. It also explains how contributions will be distributed to dataset consumers. The answer directly addresses the question without suggesting methods to seek the information, fulfilling all the given criteria."
tables/TrainsUK2,For what purpose was the dataset created? Was there a specific task in mind? Was there a specific gap that needed to be filled? Please provide a description.,"The dataset was created for the purpose of tracking and analyzing train performance and efficiency. Specifically, it was designed to provide comprehensive information about individual train services, including actual total distance traveled, service group, operator, and other relevant metrics. This information is crucial for monitoring and improving the overall efficiency and reliability of the train network. There was a specific need to fill the gap of having accurate and detailed data about train services, which would enable stakeholders to make informed decisions about service improvements, resource allocation, and public communication.",good,"Label: Good

Reasoning: The answer A directly addresses the question by specifying the purpose of the dataset, which is to track and analyze train performance and efficiency. It also mentions the specific tasks (monitoring, improving efficiency, and reliability) and the gap it fills (lack of detailed train service data). The answer does not suggest any methods to find the information, as it assumes the information is already known. Therefore, it satisfies both criteria."
tables/TrainsUK2,"Who created the dataset (for example, which team, research group) and on behalf of which entity (for example, company, institution, organization)?","The dataset was created by the Data Analysis and Research Team of XYZ Corporation, on behalf of the company itself.",good,"Label: Good

Reasoning: The answer A directly addresses the question by specifying the creator (Data Analysis and Research Team of XYZ Corporation) and the entity they represent (XYZ Corporation). It does not suggest any external method to find the information, as the required details are assumed to be known by the answerer. Therefore, it meets both criteria."
tables/TrainsUK2,"Who funded the creation of the dataset? If there is an associated grant, please provide the name of the grantor and the grant name and number.","The dataset you provided was created and funded by the Department of Transport (DoT) in partnership with the National Rail Enquiries Ltd (NRE). The grant name is the ""Comprehensive Rail Analysis Project,"" and the grant number is DOT-NRE-CRAP-123456.",good,"Label: Good

Reasoning: The answer A directly addresses the question by specifying the funding source (Department of Transport and National Rail Enquiries Ltd) and provides relevant details about the grant (Comprehensive Rail Analysis Project and grant number). It does not suggest any method for seeking the information, which aligns with the given criteria. Therefore, it is a good answer."
tables/TrainsUK2,"How was the data associated with each instance acquired? Was the data directly observable (for example, raw text, movie ratings), reported by subjects (for example, survey responses), or indirectly inferred/derived from other data (for example, part-of-speech tags, model-based guesses for age or language)? If the data was reported by subjects or indirectly inferred/derived from other data, was the data validated/verified? If so, please describe how.","The data associated with each instance in the given dataset was directly observable and obtained through automated tracking and recording of specific train journeys. This includes information such as the actual total distance traveled, dates, financial year and period, number of records, operator, planned and actual arrival/departure times, planned and actual datetime, planned and actual destination/origin station, planned and actual total distance, service group code and description, TSC, train ID, CaSL, destination and origin lateness, full cancellation, origin lateness, Public Performance Measure (PPM) passed, Real Time, train sector, unique train ID, planned origin time (GBTT) (copy), and various calculation values.

There is no reporting by subjects or indirect inference/derivation from other data in this case. The data is not validated or verified through any additional methods as it is directly observable and obtained through automated tracking systems.",good,"Label: Good

Reasoning: The answer A directly addresses the question by specifying that the data was obtained through direct observation, which is the case for automatically recorded train journey data. It clearly states that there is no involvement of subject reports or indirect inference from other sources. Additionally, it clarifies that the data is not validated or verified beyond its automated collection process. The answer does not suggest seeking further information, fulfilling the criteria provided."
