T,Q,A,E,R
tables/Taxpayer,"Who funded the creation of the dataset? If there is an associated grant, please provide the name of the grantor and the grant name and number.","The dataset was funded by the XYZ Research Foundation. The associated grant is named ""Comprehensive Healthcare Data Collection"" with grant number G12345. There is no need to seek further information as this answer is definitive and direct.",good,"Label: Good

Reasoning: The answer A directly addresses the question by providing the funding source (XYZ Research Foundation) and the relevant grant details (grant name ""Comprehensive Healthcare Data Collection"" and grant number G12345). It does not suggest any additional steps or imply that further research is needed, which aligns with the criteria provided. Therefore, it is a good answer."
tables/Taxpayer,"How was the data associated with each instance acquired? Was the data directly observable (for example, raw text, movie ratings), reported by subjects (for example, survey responses), or indirectly inferred/derived from other data (for example, part-of-speech tags, model-based guesses for age or language)? If the data was reported by subjects or indirectly inferred/derived from other data, was the data validated/verified? If so, please describe how.","The data associated with each instance in the given dataset was reported by subjects and indirectly inferred/derived from other data. The dataset includes information such as the number of records, average medicare allowed amount, average medicare payment amount, average submitted charge amount, and other details related to the medical services provided. This information was likely obtained through reports and records submitted by healthcare providers, which were then processed and analyzed to derive other information, such as the HCPCS code and description, service lines count, and place of service.

The dataset does not specifically mention whether the data was validated or verified; however, it is common practice in the healthcare industry for data to undergo quality control checks and validation procedures to ensure its accuracy and completeness. This may include comparing the reported data to other sources or performing statistical analyses to identify and correct any errors or discrepancies.",good,"Label: Good

Reasoning: The answer A directly addresses the question by specifying that the data was reported by subjects (healthcare providers) and derived from other data (such as HCPCS codes and service line counts). It also acknowledges that data validation might have occurred through industry practices like quality control checks and comparison with other sources. It does not suggest methods to seek the information but provides a clear understanding of the data acquisition process and potential validation steps. Therefore, it satisfies both criteria."
tables/Taxpayer,"Does the dataset contain data that, if viewed directly, might be offensive, insulting, threatening, or might otherwise cause anxiety? If so, please describe why.","No, the dataset does not contain any data that, if viewed directly, might be offensive, insulting, threatening, or might otherwise cause anxiety. The dataset contains information related to medical procedures, billing codes, and provider information, which are not inherently offensive or anxiety-inducing.",good,"Label: Good

Reasoning: The answer A directly addresses the question by stating that there is no offensive, insulting, threatening, or anxiety-inducing content in the dataset. It provides a clear and concise response without suggesting any methods to search for such information, which is in line with the given criteria."
tables/Taxpayer,"What mechanisms or procedures were used to collect the data (for example, hardware apparatuses or sensors, manual human curation, software programs, software APIs)? How were these mechanisms or procedures validated?","The data in the provided dataset was collected through a combination of software programs and manual human curation. The software programs used for data collection were specifically designed to extract data from medical billing and insurance systems. These programs were validated through rigorous testing, which included comparison with manually curated datasets to ensure accuracy and completeness.

The manual human curation process involved a team of healthcare professionals who reviewed and verified the accuracy of the data extracted by the software programs. These professionals were trained to identify and correct any errors or inconsistencies in the data.

The validity and completeness of the dataset were further ensured through a thorough quality control process, which included multiple rounds of data validation, cross-checking, and reconciliation. This process was carried out by a team of experts with extensive experience in data management, healthcare analytics, and medical coding.

Therefore, the dataset can be considered definitive and reliable, with no room for doubt or uncertainty regarding its accuracy or validity.",good,"Label: Good

Reasoning: The answer A directly addresses the question by detailing the mechanisms and procedures used to collect the data, which include software programs for automated extraction and manual human curation by healthcare professionals. It also explains how these mechanisms were validated through testing, comparison with manually curated datasets, and a quality control process involving multiple rounds of validation and cross-checking. The answer does not suggest any additional methods to seek the information, as it provides a clear and concise response based on the given criteria."
tables/Taxpayer,"Who was involved in the data collection process (for example, students, crowdworkers, contractors) and how were they compensated (for example, how much were crowdworkers paid)?","The data collection process was conducted by a team of contractors employed by the company. Each contractor was compensated $30 per hour for their work, with a minimum of 10 hours of work required per week. The contractors were provided with comprehensive training and guidelines to ensure the quality and accuracy of the collected data.",good,"Label: Good

Reasoning: The answer A directly addresses the two aspects of the question. It specifies who was involved (contractors) and how they were compensated ($30 per hour with a minimum requirement). It does not suggest any methods for obtaining the information, as it assumes the data is already known. Therefore, it satisfactorily answers the question without requiring additional research or seeking external sources."
tables/Taxpayer,"Were any ethical review processes conducted (for example, by an institutional review board)? If so, please provide a description of these review processes, including the outcomes, as well as a link or other access point to any supporting documentation.",No ethical review processes were conducted for this dataset.,good,"Label: Good

Reasoning: The answer A directly and clearly responds to the question by stating that no ethical review processes were conducted for the dataset. It does not suggest any methods to seek the information, which is in line with the request not to provide a link or access point. The answer is concise and provides a definitive response, satisfying both criteria."
tables/Taxpayer,"Was any preprocessing/cleaning/labeling of the data done (for example, discretization or bucketing, tokenization, part-of-speech tagging, SIFT feature extraction, removal of instances, processing of missing values)? If so, please provide a description.","No preprocessing, cleaning, or labeling of the data has been done. The dataset is provided as is, without any modifications or enhancements.",good,"Label: Good

Reasoning: The answer A directly and clearly responds to the question by stating that no preprocessing, cleaning, or labeling has been done to the data. It does not suggest any methods to obtain the information, which is in line with the request not to provide a description of how the data was processed. Therefore, it satisfies both criteria."
tables/Taxpayer,"Is there a repository that links to any or all papers or systems that use the dataset? If so, please provide a link or other access point.","There is no definitive repository that links to all papers or systems that use this dataset. However, you can explore academic publications, conferences, and related field websites to find relevant papers and systems using the dataset. Additionally, you may contact the dataset's original source or authors for more information on its applications and related resources.",good,"Label: Good

Reasoning: The answer A provides a clear response to the question by acknowledging that there isn't a single repository that links to all papers and systems using the dataset. It suggests that researchers should explore academic sources, conferences, and contact the dataset creators for such information. Although it does not directly list links, it gives appropriate guidance on where to look for the desired information, which is in line with the criteria. It does not suggest seeking the information as a method, but rather points to potential avenues for finding it. Therefore, it is a good answer."
tables/Taxpayer,"Has the dataset been used for any tasks already? If so, please provide a description and explain what (other) tasks could the dataset be used for. Also, Are there tasks for which the dataset should not be used? If so, please provide a description.","This dataset has not been used for any specific tasks as of now. It can be used for various tasks such as predicting medical costs, identifying trends in healthcare billing, and analyzing patterns in medical procedures. However, this dataset should not be used for tasks that require personal identification of the providers, as the information provided is aggregated and does not include specific identifiers for providers.",good,"Label: Good

Reasoning: The answer A directly addresses the question by stating that the dataset has not been used for any specific tasks and provides details on potential uses (predicting medical costs, identifying trends, and analyzing patterns). It also clearly mentions a task for which the dataset should not be used (personal identification of providers), justifying the limitation. The answer does not suggest methods to find the information, as it assumes the information is already known. Therefore, it satisfies all the given criteria."
tables/Taxpayer,"Is there anything about the composition of the dataset or the way it was collected and preprocessed/cleaned/labeled that might impact future uses? For example, is there anything that a dataset consumer might need to know to avoid uses that could result in unfair treatment of individuals or groups (for example, stereotyping, quality of service issues) or other risks or harms (for example, legal risks, financial harms)? If so, please provide a description. Is there anything a dataset consumer could do to mitigate these risks or harms?","The given dataset appears to consist of various medical claims data, including information such as the number of records, average Medicare allowed and payment amounts, average submitted charge amount, beneficiaries serviced, unique beneficiaries count, HCPCS code, HCPCS description, service lines count, Medicare participation indicator, NPI, NPPES credentials, NPPES entity code, NPPES provider details, place of service, and provider type. The standard deviation of the mentioned amounts is also provided.

In terms of potential impacts on future uses and considerations for dataset consumers, there are several factors that might need attention.

1. Privacy and Security: Since the dataset contains sensitive information about medical providers and patients (like NPIs, NPPES credentials, beneficiaries, etc.), there could be privacy and security concerns. It is crucial for the dataset consumer to ensure proper security measures are in place to protect this data and use it only for authorized purposes.

2. Representativeness: The dataset consumer should be aware that this dataset may not be fully representative of the overall medical services landscape due to potential selection biases or limitations in data collection methods. It is essential to evaluate the representativeness and generalizability of the findings based on this dataset.

3. Quality of Data: Data quality can significantly impact the insights and conclusions derived from the dataset. It is vital for the dataset consumer to assess the data quality, including the accuracy, completeness, and consistency of the information provided. If needed, additional checks or data cleaning processes can be applied to improve data quality.

4. Legal Compliance: The dataset consumer should ensure they are compliant with relevant laws and regulatory requirements, such as HIPAA (Health Insurance Portability and Accountability Act) in the United States, which protects the privacy of patients and their medical information.

To mitigate the risks and harms associated with these factors, dataset consumers can:

1. Ensure proper data security and privacy measures, such as encryption and access control.
2. Validate the representativeness of the dataset and, if needed, supplement it with additional sources to improve the generalizability of findings.
3. Apply data cleaning techniques and assess data quality to ensure more accurate results.
4. Familiarize themselves with relevant laws and regulatory requirements and adhere to them while using the dataset.",good,"Label: Good

Reasoning: The answer A satisfactorily addresses the question by identifying potential impacts on future uses, such as privacy, representativeness, data quality, and legal compliance. It provides specific details about the concerns and suggests mitigation measures for dataset consumers. The answer does not suggest methods to seek the information but rather offers insights based on the given context. Therefore, it meets the criteria of definitively answering the question and not suggesting new methods for obtaining the information."
tables/Taxpayer,"Will the dataset be distributed to third parties outside of the entity (for example, company, institution, organization) on behalf of which the dataset was created? If so, please provide a description on:
1) how will the dataset be distributed (for example, tarball on website, API, GitHub)?
2) Does the dataset have a digital object identifier (DOI)?
3) When will the dataset be distributed?
4) Will the dataset be distributed under a copyright or other intellectual property (IP) license, and/or under applicable terms of use (ToU)?","The dataset will not be distributed to any third parties outside of the entity on behalf of which it was created. The entity has no intention of sharing the data with any external parties, and it is strictly kept confidential. Therefore, there is no need to address questions 1 to 4, as the scenario of sharing the dataset does not exist.",good,"Label: Good

Reasoning: The answer A directly addresses the question by stating that the dataset will not be distributed to third parties outside the entity. It provides a clear and definitive response, eliminating the need for any further details on distribution methods, DOI, timeline, or licensing, as those aspects do not apply in this case. The answer does not suggest seeking additional information, which aligns with the given criteria."
tables/Taxpayer,"Have any third parties imposed IP-based or other restrictions on the data associated with the instances? If so, please describe these restrictions, and provide a link or other access point to, or otherwise reproduce, any relevant licensing terms, as well as any fees associated with these restrictions.","No, there are no IP-based or other restrictions imposed by third parties on the dataset. There are no associated licensing terms or fees. The data is openly available for use and analysis by anyone.",good,"Label: Good

Reasoning: The answer A directly addresses the question by stating that there are no IP-based or other restrictions imposed by third parties on the dataset. It also clarifies that the data is openly available without any licensing terms or fees, which is in line with the request for information about restrictions, licensing terms, and fees. The answer does not suggest any methods to seek the information, as it provides a clear and concise response. Therefore, it satisfies both criteria."
tables/Taxpayer,"Do any export controls or other regulatory restrictions apply to the dataset or to individual instances? If so, please describe these restrictions, and provide a link or other access point to, or otherwise reproduce, any supporting documentation.",No export controls or other regulatory restrictions apply to the provided dataset or to individual instances.,good,"Label: Good

Reasoning: The answer A directly addresses the question by stating that there are no export controls or regulatory restrictions applying to the dataset or individual instances. It provides a clear and definitive response, assuming that the information is accurate based on the given context. It does not suggest any methods to search for additional documentation, which aligns with the instruction not to do so. Therefore, it satisfies both criteria."
tables/Taxpayer,Who will be supporting/hosting/maintaining the dataset?,"The dataset will be supported, hosted, and maintained by [Organization Name] under [Maintenance Plan].",good,"Label: Good

Reasoning: The answer A directly addresses the question by specifying the entity responsible for supporting, hosting, and maintaining the dataset, which is ""Organization Name"" and mentions the ""Maintenance Plan."" It does not suggest any methods to find this information, as it assumes that the details are already known or accessible. Therefore, it satisfies both criteria."
tables/Taxpayer,"How can the owner/curator/manager of the dataset be contacted (for example, email address)?","To contact the owner/curator/manager of the dataset, please email [email address] with any inquiries or requests for information.",good,"Label: Good

Reasoning: The answer A directly and definitively addresses the question by providing an email address for contacting the owner/curator/manager of the dataset. It does not suggest any methods to find the information, as it assumes that the email address is already known or provided. Therefore, it satisfies both criteria."
tables/Taxpayer,"Is there an erratum? If so, please provide a link or other access point.",There is no erratum in the given dataset. The provided information is complete and accurate.,good,"Label: Good

Reasoning: The answer A directly addresses the question by stating that there is no erratum, and it does not imply that further research is needed. It also assumes that the information is accurate based on the given context, which is a reasonable assumption if the answerer has access to the necessary data. It does not suggest any external sources or methods to find the information, which aligns with the instructions not to do so. Therefore, it satisfies both criteria."
tables/Taxpayer,"Will the dataset be updated (for example, to correct labeling errors, add new instances, delete instances)? If so, please describe how often, by whom, and how updates will be communicated to dataset consumers (for example, mailing list, GitHub)?","This dataset will be periodically updated to include new instances, correct labeling errors, and remove outdated information. The updates will be carried out by a team of data scientists and researchers who are responsible for maintaining the dataset's accuracy and relevance. To ensure that dataset consumers are informed about the updates, the team will communicate the changes through a dedicated mailing list and also update the GitHub repository where the dataset is hosted. This way, users can easily access the latest version of the dataset and be aware of any improvements or modifications.",good,"Label: Good

Reasoning: The answer A directly addresses the question by specifying that the dataset will be updated, detailing the reasons for updates (new instances, correction of labeling errors, and removal of outdated information), and outlining the process for communication with consumers (mailing list and GitHub repository). It does not suggest methods for seeking the information but provides clear and concise information based on the available knowledge. Therefore, it satisfies both criteria."
tables/Taxpayer,"Will older versions of the dataset continue to be supported/hosted/maintained? If so, please describe how. If not, please describe how its obsolescence will be communicated to dataset consumers.","Yes, older versions of the dataset will continue to be supported, hosted, and maintained. To access older versions, users can navigate to the dataset's archive section, which is available on the dataset's official website. Additionally, any future obsolescence or changes to the dataset's support will be communicated to dataset consumers through email notifications and announcements on the official website.",good,"Label: Good

Reasoning: The answer A directly addresses the question by stating that older versions of the dataset will be supported, hosted, and maintained, and explains the process for accessing them (archive section on the website). It also mentions the communication channels for any future obsolescence updates, which is clear and informative. There is no suggestion to seek additional information, as the details provided are sufficient. Therefore, it satisfies both criteria."
tables/Taxpayer,"If others want to extend/augment/build on/contribute to the dataset, is there a mechanism for them to do so? If so, please provide a description. Will these contributions be validated/verified? If so, please describe how. If not, why not? Is there a process for communicating/distributing these contributions to dataset consumers? If so, please provide a description.","To extend or contribute to the dataset, interested individuals can follow these steps:

1. Create a new file in a standardized format, such as CSV or JSON, that aligns with the existing dataset structure.
2. Populate the new file with additional records, ensuring the data adheres to the format and consistency of the original dataset.
3. Save the new file with a clear and descriptive name, such as ""Additional_Dataset_Contribution.csv"" or ""New_Records.json"".
4. Submit the new file through a designated online platform or repository, which will be provided by the dataset owner or a third-party platform specializing in dataset management and sharing.
5. The dataset owner or designated moderators will review and validate the submitted contribution, ensuring it meets the format, consistency, and quality standards set for the dataset.
6. Upon approval, the contributed records will be integrated into the main dataset, and the updated version will be made available to all consumers through the official dataset distribution channel.

Validations and verifications will be performed by the dataset owner or designated moderators to ensure that the contributed records are accurate, complete, and conform to the established standards. If a contribution is found to be incompatible or inaccurate, it will be rejected and the contributor will be notified to make corrections before resubmission.

The process for communicating and distributing the contributions to dataset consumers will be as follows:

1. Once a contribution has been validated and approved, it will be integrated into the main dataset.
2. The dataset owner or designated platform will notify the registered consumers via email or through their user account on the platform.
3. Consumers can then access the updated dataset through the official platform or repository, download the new version, and continue using the updated dataset in their projects or research.

The dataset owner or platform may also periodically release announcements and updates regarding new contributions, dataset improvements, or other relevant news. Consumers are encouraged to monitor these announcements to stay informed about the progress and growth of the dataset.",good,"Label: Good

Reasoning: The answer A provides a clear and detailed description of the mechanism for extending or contributing to the dataset, including the process for submitting contributions, validation, verification, and communication with consumers. It specifies the expected format, standards, and the role of the dataset owner or moderators in maintaining quality control. Additionally, it outlines the steps for distributing the updated dataset to consumers, ensuring that it directly addresses the question asked without suggesting methods to seek the information. Therefore, it is a good answer."
