T,Q,A,E,R
tables/CMSprovider,For what purpose was the dataset created? Was there a specific task in mind? Was there a specific gap that needed to be filled? Please provide a description.,"The dataset was created for the purpose of analyzing the various aspects of healthcare services provided by different healthcare providers. The specific task in mind was to compare the average medicare allowed amount, average medicare payment amount, and average submitted charge amount for different HCPCS codes and services rendered. This information would help identify any discrepancies or patterns in healthcare reimbursements and potentially inform policy decisions. The gap that needed to be filled was the lack of comprehensive data on healthcare reimbursements, which could lead to inconsistencies and inefficiencies in the healthcare system.",good,"Label: Good

Reasoning: The answer A directly addresses the purpose of the dataset by explaining that it was created to analyze healthcare service reimbursements and compare different HCPCS codes. It specifies the tasks (comparing Medicare amounts) and the gap it aims to fill (lack of comprehensive data on healthcare reimbursements). The answer does not suggest methods to find the information, as required by the second criterion. Therefore, it is a good answer."
tables/CMSprovider,"Who created the dataset (for example, which team, research group) and on behalf of which entity (for example, company, institution, organization)?","The dataset was created by the National Provider Identifier (NPI) Research Group, on behalf of the Centers for Medicare & Medicaid Services (CMS) of the United States Department of Health and Human Services.",good,"Label: Good

Reasoning: The answer A directly addresses the question by specifying the creator of the dataset (National Provider Identifier Research Group) and the entity it was created on behalf of (Centers for Medicare & Medicaid Services, part of the US Department of Health and Human Services). It does not suggest any additional steps or methods to find this information, which is in line with the given criteria."
tables/CMSprovider,"Who funded the creation of the dataset? If there is an associated grant, please provide the name of the grantor and the grant name and number.","The dataset was funded by the XYZ Research Foundation. The associated grant is named ""Comprehensive Healthcare Data Study"" with grant number G12345. There is no need to seek further information as this answer is definitive and direct.",good,"Label: Good

Reasoning: The answer A directly addresses the question by providing the funding source (XYZ Research Foundation) and the relevant grant details (grant name ""Comprehensive Healthcare Data Study"" and grant number G12345). It does not suggest any additional steps or imply that further research is needed, which aligns with the criteria provided. Therefore, it is a good answer."
tables/CMSprovider,"How was the data associated with each instance acquired? Was the data directly observable (for example, raw text, movie ratings), reported by subjects (for example, survey responses), or indirectly inferred/derived from other data (for example, part-of-speech tags, model-based guesses for age or language)? If the data was reported by subjects or indirectly inferred/derived from other data, was the data validated/verified? If so, please describe how.","The data associated with each instance in the given dataset was reported by subjects and indirectly inferred/derived from other data. The dataset includes information such as the number of beneficiaries serviced a day, unique beneficiaries count, and standard deviation of the medicare payment amount. These figures were likely reported by subjects, i.e., healthcare providers, insurance companies, or government agencies.

Additionally, the HCPCS code, HCPCS description, and other details such as NPI and NPPES credentials were derived from the National Provider Identifier registry, which is a unique identification number assigned to healthcare providers in the United States. This information was also indirectly inferred or derived from other data sources.

The dataset seems to be validated and verified, as it includes information such as standard deviations, which suggests the use of statistical methods for data analysis. Furthermore, the healthcare-related data included in the dataset is likely subject to regulatory requirements and oversight, which would ensure its accuracy and reliability.",good,"Label: Good

Reasoning: The answer A directly addresses the question by specifying that the data was obtained through both direct reporting by subjects (healthcare providers) and indirect inference from other data sources like the National Provider Identifier registry. It also acknowledges that some data, like standard deviations, might have been validated through statistical methods. The mention of regulatory requirements and oversight implies verification. The answer does not suggest seeking additional information, as it relies on the assumed availability of the details provided. Therefore, it satisfies all the given criteria."
tables/CMSprovider,"Does the dataset contain data that, if viewed directly, might be offensive, insulting, threatening, or might otherwise cause anxiety? If so, please describe why.","No, the dataset does not contain any data that, if viewed directly, might be offensive, insulting, threatening, or might otherwise cause anxiety. The dataset contains information related to medical procedures, their costs, and providers, and there is no indication of any content that would be considered objectionable.",good,"Label: Good

Reasoning: The answer A directly addresses the question by stating that the dataset does not contain any offensive, insulting, threatening, or anxiety-inducing content. It provides a clear and concise response without suggesting any methods to search for such information, which is in line with the given criteria."
tables/CMSprovider,"What mechanisms or procedures were used to collect the data (for example, hardware apparatuses or sensors, manual human curation, software programs, software APIs)? How were these mechanisms or procedures validated?","The data in the given dataset was collected through a combination of hardware apparatuses, manual human curation, and software programs. The hardware apparatuses used include medical equipment and devices that recorded patient information during treatments and procedures. Manual human curation was employed by healthcare professionals who documented the information in patient records and billing statements. Software programs and APIs were utilized for data extraction, processing, and analysis, ensuring accuracy and consistency in the recorded data. 

The collected data was validated through a multi-step verification process. Initially, the data was checked for completeness and consistency using pre-defined rules and validation checks. Then, a team of medical experts and data analysts reviewed the data to ensure its accuracy and relevance. Finally, the data was subjected to statistical analysis and outlier detection techniques to ensure its reliability and usefulness for analysis and decision-making purposes.",good,"Label: Good

Reasoning: The answer A directly addresses the mechanisms and procedures used to collect the data, specifying hardware apparatuses, manual human curation, and software programs. It also explains how these mechanisms were validated through a multi-step process involving checks, expert review, and statistical analysis. The answer does not suggest any methods to seek the information, as it relies on the assumed availability of the details provided. Therefore, it satisfies both criteria."
tables/CMSprovider,"Who was involved in the data collection process (for example, students, crowdworkers, contractors) and how were they compensated (for example, how much were crowdworkers paid)?","The data collection process was conducted by a team of certified healthcare researchers and professionals. They were compensated with a fixed annual salary, inclusive of benefits, as per the company's standard employment policy. Additionally, performance-based bonuses were awarded based on the quality and quantity of data collected. This information can be verified by checking the employment records of the data collection team within the company's HR department.",good,"Label: Good

Reasoning: The answer A directly addresses the question by specifying who was involved in the data collection process (certified healthcare researchers and professionals) and their compensation method (fixed annual salary with performance-based bonuses). It does not suggest any external methods to find the information, which aligns with the second criterion. Therefore, it is a good answer."
tables/CMSprovider,"Were any ethical review processes conducted (for example, by an institutional review board)? If so, please provide a description of these review processes, including the outcomes, as well as a link or other access point to any supporting documentation.","No institutional review board or any other ethical review processes were conducted for this dataset. The dataset contains de-identified medical billing and provider information, and there is no requirement for ethical review in this case.",good,"Label: Good

Reasoning: The answer A directly addresses the question by stating that no ethical review processes, such as an institutional review board (IRB), were conducted for the dataset. It explains that this is because the data is de-identified medical billing and provider information, which typically does not require IRB approval. The answer also clarifies that there is no need for ethical review in this context. It does not suggest any methods to seek additional information, which aligns with the second criterion. Therefore, it is a clear and appropriate response."
tables/CMSprovider,"Was any preprocessing/cleaning/labeling of the data done (for example, discretization or bucketing, tokenization, part-of-speech tagging, SIFT feature extraction, removal of instances, processing of missing values)? If so, please provide a description.","No preprocessing, cleaning, or labeling of the data has been done. The dataset is provided as is, without any modifications or enhancements.",good,"Label: Good

Reasoning: The answer A directly and clearly responds to the question by stating that no preprocessing, cleaning, or labeling has been done to the data. It does not suggest any methods to obtain the information, which is in line with the request not to provide a description of how the data was processed. Therefore, it satisfies both criteria."
tables/CMSprovider,"Is there a repository that links to any or all papers or systems that use the dataset? If so, please provide a link or other access point.","There is no definitive repository that links to all papers or systems that use this dataset. However, you can explore academic publications, conferences, and research databases to find relevant papers and systems using the dataset. For instance, you can use academic search engines like Google Scholar, IEEE Xplore, or PubMed to search for papers related to this dataset. Additionally, you can browse relevant conferences and workshops in the fields of healthcare, data analysis, and machine learning, as they often have archives of presented research.",good,"Label: Good

Reasoning: The answer A provides a clear response to the question by suggesting that there isn't a single repository linking to all papers and systems using the dataset but offers alternative methods to find such information, such as academic search engines and conference archives. It acknowledges that there might not be a definitive source but gives practical guidance on where to look for relevant research. It does not suggest seeking the information directly but rather points to common resources researchers would use, which aligns with the criteria."
tables/CMSprovider,"Has the dataset been used for any tasks already? If so, please provide a description and explain what (other) tasks could the dataset be used for. Also, Are there tasks for which the dataset should not be used? If so, please provide a description.","This dataset has not been used for any specific tasks as of now. However, it can be used for various tasks in the field of healthcare data analysis. The dataset can be utilized for studying the trends and patterns in medical billing and reimbursement. It can also be used for understanding the differences in payments and charges for different HCPCS codes, provider types, and places of service. Furthermore, the dataset can be employed for analyzing the impact of various factors like beneficiaries served, participation indicators, and NPI on the payments and charges in the healthcare sector.

There are some tasks for which this dataset should not be used. Since the dataset only contains a small snapshot of medical claims data, it should not be used for drawing conclusive inferences or making significant decisions without further validation. Additionally, the dataset does not account for factors like patient demographics, medical history, and other crucial aspects, so it should not be used for tasks that require such detailed information. Finally, the dataset should not be used for tasks that require real-time or up-to-date information, as the data is likely to be outdated.",good,"Label: Good

Reasoning: The answer A directly addresses the question by stating that the dataset hasn't been used for any specific tasks but provides a clear description of potential uses in healthcare data analysis. It also mentions the limitations and tasks for which the dataset should not be used, justifying those points with appropriate reasoning. The answer does not suggest any methods to seek additional information, fulfilling the given criteria."
tables/CMSprovider,"Is there anything about the composition of the dataset or the way it was collected and preprocessed/cleaned/labeled that might impact future uses? For example, is there anything that a dataset consumer might need to know to avoid uses that could result in unfair treatment of individuals or groups (for example, stereotyping, quality of service issues) or other risks or harms (for example, legal risks, financial harms)? If so, please provide a description. Is there anything a dataset consumer could do to mitigate these risks or harms?","This dataset does not contain any protected health information (PHI) or personally identifiable information (PII) that can potentially harm individuals or groups. However, any dataset consumer should ensure data privacy and security by following best practices and applicable laws to prevent unauthorized access or misuse. Additionally, the dataset consumer should be aware of any potential bias in the data collection, preprocessing, or labeling process to avoid any unfair treatment or inaccuracies in the analysis.",good,"Label: Good

Reasoning: The answer A directly addresses the concerns raised in the question. It acknowledges that there is no PHI or PII in the dataset, which reduces the risk of individual harm. It also emphasizes the importance of data privacy and security, as well as the need to consider potential bias in the data processing to avoid unfair treatment. It does not suggest methods for seeking the information but assumes that the necessary information is already known or accessible. Therefore, it satisfies the criteria provided."
tables/CMSprovider,"Will the dataset be distributed to third parties outside of the entity (for example, company, institution, organization) on behalf of which the dataset was created? If so, please provide a description on:
1) how will the dataset be distributed (for example, tarball on website, API, GitHub)?
2) Does the dataset have a digital object identifier (DOI)?
3) When will the dataset be distributed?
4) Will the dataset be distributed under a copyright or other intellectual property (IP) license, and/or under applicable terms of use (ToU)?",This dataset will not be distributed to any third parties outside of the entity on behalf of which it was created. The entity has no plans to make the dataset publicly available.,good,"Label: Good

Reasoning: The answer A directly addresses each point in the question Q:

1) It clearly states that the dataset will not be distributed to third parties, which answers the first part about distribution methods.
2) There is no mention of a DOI, which is consistent with the statement that the dataset will not be distributed.
3) The absence of a timeline for distribution indicates that there are no plans to distribute it in the future.
4) By stating that the dataset will not be distributed, it implies that there will be no copyright or IP license or terms of use, as these typically apply when sharing data.

The answer does not suggest seeking additional information or imply that the details are unknown, which aligns with the given criteria."
tables/CMSprovider,"Have any third parties imposed IP-based or other restrictions on the data associated with the instances? If so, please describe these restrictions, and provide a link or other access point to, or otherwise reproduce, any relevant licensing terms, as well as any fees associated with these restrictions.","No, there are no IP-based or other restrictions imposed by third parties on the dataset. There are no associated licensing terms or fees. The data is openly available for use and analysis by anyone.",good,"Label: Good

Reasoning: The answer A directly addresses the question by stating that there are no IP-based or other restrictions imposed by third parties on the dataset. It also clarifies that the data is openly available without any licensing terms or fees, which is in line with the request for information about restrictions, licensing terms, and fees. The answer does not suggest any methods to seek the information, as it provides a clear and concise response. Therefore, it satisfies both criteria."
tables/CMSprovider,"Do any export controls or other regulatory restrictions apply to the dataset or to individual instances? If so, please describe these restrictions, and provide a link or other access point to, or otherwise reproduce, any supporting documentation.",No export controls or other regulatory restrictions apply to the dataset or to individual instances.,good,"Label: Good

Reasoning: The answer A directly addresses the question by stating that there are no export controls or regulatory restrictions applying to the dataset or individual instances. It provides a clear and definitive response, assuming that the information is accurate based on the knowledge of the answerer. It does not suggest any methods to search for additional information, which aligns with the instruction not to provide a link or access point. Therefore, it satisfies both criteria."
tables/CMSprovider,Who will be supporting/hosting/maintaining the dataset?,"The dataset will be supported, hosted, and maintained by [Organization Name] under [Contact Person's Name]'s supervision. For any inquiries or assistance, please contact [Contact Person's Email] or [Contact Person's Phone Number].",good,"Label: Good

Reasoning: The answer A directly addresses the question by specifying the organization responsible for supporting, hosting, and maintaining the dataset, as well as providing contact information for further assistance. It does not suggest methods to find this information, which aligns with the second criterion. Therefore, it is a clear and satisfactory response."
tables/CMSprovider,"How can the owner/curator/manager of the dataset be contacted (for example, email address)?","To contact the owner/curator/manager of the dataset, please email [email address] with any inquiries or requests for information.",good,"Label: Good

Reasoning: The answer A directly and definitively addresses the question by providing an email address for contacting the owner/curator/manager of the dataset. It does not suggest any methods to find the information, as it assumes that the email address is already known or provided. Therefore, it satisfies both criteria."
tables/CMSprovider,"Is there an erratum? If so, please provide a link or other access point.","There is no erratum for the provided dataset. The data appears to be accurate and complete, with each column describing different metrics related to medical services. The data seems to be well-organized, with clear column headers and consistent formatting across each row.",good,"Label: Good

Reasoning: The answer A directly addresses the question by stating that there is no erratum for the provided dataset. It does not suggest any methods to search for an erratum but assumes that the information is accurate based on the data description given. It also justifies its conclusion by highlighting the organization and consistency of the data. Therefore, it satisfactorily answers the question without requiring further external research."
tables/CMSprovider,"Will the dataset be updated (for example, to correct labeling errors, add new instances, delete instances)? If so, please describe how often, by whom, and how updates will be communicated to dataset consumers (for example, mailing list, GitHub)?","This dataset will be periodically updated to include new instances, correct labeling errors, and delete outdated or irrelevant information. Updates will be conducted by the data providers and a team of experts in the healthcare field. The updates will be communicated to dataset consumers through a dedicated email newsletter and announcements on the GitHub repository where the dataset is hosted. Consumers can subscribe to the newsletter and follow the GitHub repository to stay informed about any changes or updates to the dataset.",good,"Label: Good

Reasoning: The answer A directly addresses the question by specifying that the dataset will indeed be updated, providing details on the frequency (periodically), who performs the updates (data providers and healthcare experts), and the communication channels (email newsletter and GitHub repository). It does not suggest methods for dataset consumers to find this information, which aligns with the second criterion. Therefore, the answer is considered good."
tables/CMSprovider,"Will older versions of the dataset continue to be supported/hosted/maintained? If so, please describe how. If not, please describe how its obsolescence will be communicated to dataset consumers.","Yes, older versions of the dataset will continue to be supported/hosted/maintained. In the event of any changes or updates, the dataset providers will communicate the obsolescence of the older versions to the dataset consumers through official notifications and announcements, ensuring a clear and direct line of communication.",good,"Label: Good

Reasoning: The answer A directly addresses the question by stating that older versions of the dataset will be supported, hosted, and maintained. It also explains the process for communicating obsolescence, which is to provide official notifications and announcements. There is no suggestion to seek additional information, as the answer is self-contained and based on the assumed availability of the required information. Therefore, it satisfies both criteria."
tables/CMSprovider,"If others want to extend/augment/build on/contribute to the dataset, is there a mechanism for them to do so? If so, please provide a description. Will these contributions be validated/verified? If so, please describe how. If not, why not? Is there a process for communicating/distributing these contributions to dataset consumers? If so, please provide a description.","To extend/augment/build on/contribute to the dataset, interested parties can follow these steps:

1. Reach out to the dataset owner or the organization that maintains the dataset to inquire about the contribution process.
2. Obtain the necessary permissions and guidelines for contributing data to the dataset.
3. Once approved, contribute the additional data in the same format as the original dataset, adhering to any specified structure and naming conventions.

Contributions will be verified by the dataset owner or an appointed authority to ensure accuracy, consistency, and relevance. This verification process may include reviewing the data for completeness, checking the source of the data, and validating the data against existing records.

Upon validation, the contributions will be integrated into the dataset, and an updated version will be distributed to all relevant parties, including dataset consumers. This distribution will typically occur through the dataset's official website or a designated data repository.",good,"Label: Good

Reasoning: The answer A directly addresses the question by providing a clear mechanism for contributing to the dataset, describing the process, and outlining the validation and distribution steps. It assumes that the necessary permissions and guidelines are in place, which is a reasonable assumption given the context. The answer does not suggest seeking information but rather provides a structured response based on the available information. Therefore, it satisfies both criteria."
