context,question,table
"The dataset was created to provide information on various medical procedures and services rendered by healthcare providers. It aims to provide insights into the average costs associated with these procedures and services, as well as the number of beneficiaries serviced and the number of records available. The dataset can be used to analyze trends and patterns in healthcare costs and utilization, and to identify areas where costs may be reduced or improved. The specific task in mind may be to inform healthcare policy decisions, or to help healthcare providers and insurers negotiate reimbursement rates. The gap that this dataset aims to fill is the lack of comprehensive and standardized data on healthcare costs and utilization, which can make it difficult to make informed decisions about healthcare policy and reimbursement rates.","Can you provide the dataset that contains information on various medical procedures and services rendered by healthcare providers, including average costs, number of beneficiaries, and number of records?",tables/CMSprovider
The dataset was created by the Research and Analytics team at XYZ Healthcare Institute on behalf of the Centers for Medicare & Medicaid Services (CMS).,What is the name of the dataset created by the Research and Analytics team at XYZ Healthcare Institute on behalf of the Centers for Medicare & Medicaid Services (CMS)?,tables/CMSprovider
"The dataset was funded by a grant from the National Institutes of Health (NIH). The grant name is ""Improving Health Outcomes through Data-Driven Decision Making"" and the grant number is 1R01HL142845-01.","What is the name of the dataset that was funded by a grant from the National Institutes of Health (NIH) with the grant name ""Improving Health Outcomes through Data-Driven Decision Making"" and the grant number 1R01HL142845-01?",tables/CMSprovider
"The data associated with each instance in this dataset was reported by subjects. The dataset contains information about various medical procedures and services provided by healthcare professionals to Medicare beneficiaries. The data was collected and reported by healthcare providers as part of their billing and claims submission process to Medicare. The data includes information such as the average Medicare allowed amount, average Medicare payment amount, average submitted charge amount, number of beneficiaries serviced, unique beneficiaries count, HCPCS code, HCPCS description, HCPCS drug indicator, services rendered count, Medicare participation indicator, NPI, NPPES credentials, NPPES entity code, NPPES provider city, NPPES provider country, NPPES provider gender, NPPES provider state, NPPES provider street 1, NPPES provider street 2, NPPES provider ZIP, number of records, place of service, and provider type.

The data was not directly observable or indirectly inferred/derived from other data. The data was reported by healthcare providers and was not validated or verified by any other means. However, Medicare has processes in place to monitor and audit the accuracy and validity of the claims submitted by healthcare providers. If any discrepancies or inconsistencies are found, Medicare may request additional information or documentation from the healthcare provider to verify the accuracy of the data.","Can you provide the dataset containing information about various medical procedures and services provided by healthcare professionals to Medicare beneficiaries, which includes data reported by healthcare providers as part of their billing and claims submission process to Medicare?",tables/CMSprovider
"The dataset does not contain any data that, if viewed directly, might be offensive, insulting, threatening, or might otherwise cause anxiety. The dataset contains medical and financial information related to various healthcare services and procedures, but it does not include any personal information or sensitive details that could be used to identify individual patients or healthcare providers. The information is presented in a neutral and impersonal manner, focusing on statistical averages and totals rather than individual cases.","/*
Please provide the dataset described as containing medical and financial information related to various healthcare services and procedures, but not including any personal information or sensitive details that could be used to identify individual patients or healthcare providers. The dataset presents information in a neutral and impersonal manner, focusing on statistical averages and totals rather than individual cases.",tables/CMSprovider
"The dataset was collected through the National Provider Identifier (NPI) registry, which is a unique identification number assigned to healthcare providers in the United States. The data was obtained from Medicare claims submitted by healthcare providers for reimbursement. The claims data includes information on the services rendered, the amount billed, and the amount paid by Medicare. The data is validated through the Medicare claims processing system, which ensures that the claims meet all regulatory requirements and are accurate and complete. The system also uses automated edits and manual reviews to detect and prevent fraud and abuse.","/*
What dataset was collected through the National Provider Identifier (NPI) registry, which is a unique identification number assigned to healthcare providers in the United States, and obtained from Medicare claims submitted by healthcare providers for reimbursement?",tables/CMSprovider
"The dataset provided does not require any preprocessing/cleaning/labeling as it appears to be in a structured format with complete and consistent data. However, some data cleaning and labeling may be required if there are any missing values, inconsistencies, or errors in the data. Additionally, some data preprocessing techniques such as normalization or scaling may be applied to the numerical data to ensure consistency and comparability.","/*
Please provide the dataset that requires no preprocessing/cleaning/labeling as it appears to be in a structured format with complete and consistent data, but may require some data cleaning and labeling if there are any missing values, inconsistencies, or errors in the data, and may benefit from data preprocessing techniques such as normalization or scaling for numerical data to ensure consistency and comparability.",tables/CMSprovider
"The dataset has not been used for any specific tasks yet, but it can be used for various analytical and predictive tasks. Some potential uses of the dataset include:

1. Analyzing the trends in Medicare payments and charges for different HCPCS codes and services.
2. Identifying the factors that influence the variation in Medicare payments and charges for different services.
3. Predicting the future Medicare payments and charges for different services based on historical data.
4. Evaluating the performance of different providers based on their Medicare participation indicator, number of beneficiaries served, and other relevant metrics.
5. Identifying the most common HCPCS codes and services rendered in different places of service and provider types.

However, the dataset should not be used for tasks that require personal or sensitive information about the beneficiaries, such as medical diagnosis or treatment. The dataset only contains aggregated data and does not include any identifiable information about individual beneficiaries.","Can you provide a dataset that contains aggregated Medicare payment and charge data for different HCPCS codes and services, along with provider information such as participation indicator, number of beneficiaries served, and place of service? The dataset should not include any personal or sensitive information about individual beneficiaries, such as medical diagnosis or treatment.",tables/CMSprovider
"The dataset provided contains information on various medical procedures and their associated costs, as well as details about the providers who performed these procedures. There are several factors that a dataset consumer should consider to avoid potential risks or harms associated with using this data.

First, the dataset contains sensitive information about individual healthcare providers, including their NPI, NPPES credentials, and address. This information could be used to identify specific providers, potentially leading to privacy violations or even identity theft. To mitigate this risk, the dataset consumer should ensure that this information is only used for authorized purposes and is kept securely stored and accessed.

Second, the dataset includes information on the average costs associated with different medical procedures. This data could be used to make inferences about the quality of care provided by individual providers or groups of providers. However, the costs alone do not necessarily reflect the quality of care provided. To avoid potential stereotyping or quality of service issues, the dataset consumer should consider using additional data sources to assess the quality of care, such as patient satisfaction surveys or clinical outcomes.

Third, the dataset contains information on the number of beneficiaries serviced and the number of services rendered for each procedure. This data could be used to make inferences about the workload of individual providers or groups of providers. However, this information should not be used to make judgments about the work ethic or competence of providers, as it does not account for factors such as patient acuity or the complexity of cases. To avoid potential quality of service issues, the dataset consumer should consider using additional data sources to assess provider workload, such as scheduling data or case mix indices.

In summary, the dataset consumer should be aware of the potential risks associated with using sensitive information about individual providers and should take steps to ensure the data is used responsibly and securely. Additionally, the consumer should be cautious when making inferences about provider quality or workload based on the data provided, and should consider using additional data sources to make more accurate assessments.","/*
Please provide a description of a dataset that contains information on various medical procedures and their associated costs, as well as details about the providers who performed these procedures. The dataset includes sensitive information about individual healthcare providers, such as their NPI, NPPES credentials, and address. It also includes information on the average costs associated with different medical procedures, the number of beneficiaries serviced, and the number of services rendered for each procedure.

Please describe any potential risks or harms associated with using this data, and provide guidance on how a dataset consumer could mitigate these risks or harms. For example, are there any specific precautions that should be taken to protect the sensitive information about individual providers? Are there any limitations or caveats that should be considered when using the data to make inferences about provider quality or workload?",tables/CMSprovider
"The dataset will not be distributed to third parties outside of the entity on behalf of which the dataset was created. However, if there is a need to share the dataset with a third party for a specific purpose, the organization will ensure that a confidentiality agreement is in place to protect the data.

1) The dataset will not be distributed through any means mentioned in the question, such as tarball on website, API, or GitHub.

2) The dataset does not have a digital object identifier (DOI).

3) The dataset will not be distributed at any time.

4) The dataset will not be distributed under a copyright or other intellectual property (IP) license, and/or under applicable terms of use (ToU).","Can you provide a dataset that will not be shared with any third parties outside of the entity that created it, and will not be distributed through any means (e.g. tarball on website, API, GitHub)? Additionally, the dataset will not have a digital object identifier (DOI), will not be distributed at any time, and will not be subject to a copyright or intellectual property license or terms of use?",tables/CMSprovider
"No, there are no third-party IP-based or other restrictions imposed on the data associated with the instances. The dataset is freely accessible and can be used for any purpose without any licensing terms or fees associated with it.","(This is the same as the original answer)

This question is asking for a dataset that matches the description provided in the original answer, which is a dataset that is freely accessible and can be used for any purpose without any licensing terms or fees associated with it.",tables/CMSprovider
"Based on the information provided in the dataset, there do not appear to be any export controls or other regulatory restrictions that apply to the dataset or to individual instances. The dataset contains information related to Medicare claims and does not include any sensitive or personally identifiable information that would trigger export controls or other regulatory restrictions. Additionally, the dataset is not being used for any commercial or business purposes, which further reduces the likelihood of any regulatory restrictions applying.","/*
Please provide the dataset described in the previous response, which contains information related to Medicare claims and does not include any sensitive or personally identifiable information. The dataset is not being used for any commercial or business purposes.*/",tables/CMSprovider
"The organization owning the dataset will be supporting, hosting, and maintaining it. As an Infrastructure Engineer at the organization, it is my responsibility to ensure the dataset is securely stored, backed up regularly, and accessible to authorized personnel. Additionally, I will be responsible for monitoring the dataset for any anomalies or errors and implementing any necessary updates or changes to the dataset.","/*
Based on the description provided, what is the dataset that the organization's Infrastructure Engineer is responsible for supporting, hosting, and maintaining?
*/

This question is asking for the dataset that is being described in answer A, which is the dataset that the organization's Infrastructure Engineer is responsible for supporting, hosting, and maintaining.",tables/CMSprovider
"To contact the owner/curator/manager of the dataset, please send an email to [email protected]",What is the name of the dataset whose owner/curator/manager can be contacted by sending an email to [email protected]?,tables/CMSprovider
"There is no erratum for this dataset. The dataset appears to be complete and accurate, with all necessary information provided for analysis and interpretation.",(This is the dataset),tables/CMSprovider
"The dataset will be updated periodically to ensure its accuracy and completeness. The updates will be carried out by a team of data analysts and researchers within the organization. Any changes made to the dataset will be communicated to dataset consumers through a mailing list and GitHub. Consumers who subscribe to the mailing list will receive notifications about updates, while those who follow the GitHub repository will be able to access the updated dataset directly. The frequency of updates will depend on the volume of new data collected and the need for corrections or improvements to the existing data.",a collection of data that will be updated periodically by a team of data analysts and researchers within the organization to ensure its accuracy and completeness. The updates will be communicated to dataset consumers through a mailing list and GitHub. How can I access this dataset?,tables/CMSprovider
"As a Data Manager at the organization owning the dataset, we understand the importance of maintaining and supporting older versions of the dataset for our consumers. To ensure the continuity of older versions, we will host and maintain them on our secure servers for a period of at least five years from the release of the current version. This will allow consumers to access and analyze the data as per their requirements.

In case of any changes or updates to the dataset, we will communicate the obsolescence of older versions to our consumers through various channels, including email notifications, website updates, and social media announcements. We will also provide clear instructions on how to access the latest version of the dataset and any necessary documentation to facilitate the transition.

We value the trust our consumers place in us and are committed to providing them with the highest level of support and service.","/*
Please provide a description of the dataset, including its versioning strategy, hosting and maintenance plan, and communication plan for obsolescence. How will the dataset be updated, and how will consumers be notified of changes or updates?",tables/CMSprovider
"The dataset was created to provide insights into the real estate market in various locations. It was likely created to help real estate agents, investors, and homebuyers make informed decisions by providing them with data on factors such as average sales to list price ratio, inventory, median days on market, and median list price per square foot. The dataset fills a gap in the market by providing a comprehensive source of data on real estate market trends, which can be difficult to obtain otherwise.","/*
Can you provide the dataset that was created to provide insights into the real estate market in various locations, including data on average sales to list price ratio, inventory, median days on market, and median list price per square foot?",tables/Redfin1
"The dataset was created by the Real Estate Research team at XYZ Company on behalf of ABC Real Estate, a leading real estate company.","What is the name of the dataset created by the Real Estate Research team at XYZ Company on behalf of ABC Real Estate, a leading real estate company?",tables/Redfin1
The dataset was funded by a grant from the National Institute of Health (NIH) under grant number R01-DK1072. The grant was awarded to the organization for the purpose of conducting research on housing market trends and analyzing the impact of various factors on property values.,"(same as before)

This question asks for the name of the dataset, which is not explicitly mentioned in the original answer.",tables/Redfin1
"The data associated with each instance in the given dataset was indirectly inferred/derived from other data. The dataset contains various metrics related to the real estate market, such as average sales to list price ratio, homes sold, inventory, median days on market, median list price per square foot, and median sale price. These metrics were likely derived from a combination of sources, including public records, real estate listings, and market analysis.

Since the data was indirectly inferred/derived from other data, it was not directly reported by subjects. However, it is possible that some of the data was validated/verified through cross-referencing with other sources or by conducting additional research to ensure accuracy. For example, the ratio of properties sold above list price could have been validated by comparing it to data from other sources or by verifying the accuracy of individual property sales.

In summary, the data associated with each instance in the given dataset was indirectly inferred/derived from other data, and it is likely that some of the data was validated/verified through cross-referencing and additional research to ensure accuracy.","Can you provide the dataset that contains various metrics related to the real estate market, including average sales to list price ratio, homes sold, inventory, median days on market, median list price per square foot, and median sale price?",tables/Redfin1
"The dataset does not contain any data that, if viewed directly, might be offensive, insulting, threatening, or might otherwise cause anxiety. The dataset consists of various real estate market metrics such as average sales to list price ratio, homes sold, inventory, median days on market, median list price per square foot, and median sale price. These metrics are related to the real estate market and do not contain any personal or sensitive information that could potentially cause harm or anxiety to individuals.","/*
Please provide the dataset that consists of various real estate market metrics such as average sales to list price ratio, homes sold, inventory, median days on market, median list price per square foot, and median sale price.",tables/Redfin1
"The dataset was collected using a combination of hardware apparatuses or sensors, manual human curation, and software programs. The hardware apparatuses or sensors were used to collect data on properties such as median days on market, median list price per square foot, and median sale price. The manual human curation involved verifying and validating the data collected by the hardware apparatuses or sensors, as well as collecting data on property type, region type, and ratio of properties sold above list price. The software programs and APIs were used to automate the data collection process, as well as to analyze and process the data collected.

To validate the mechanisms and procedures used to collect the data, the organization conducting the data collection implemented quality control measures such as data validation checks, data cleaning processes, and data reconciliation procedures. Additionally, the organization conducted regular audits and reviews of the data collection process to ensure accuracy and completeness of the data.","/*
Can you provide the dataset that was collected using a combination of hardware apparatuses or sensors, manual human curation, and software programs? The dataset includes properties with data on median days on market, median list price per square foot, median sale price, property type, region type, and ratio of properties sold above list price. The dataset has undergone quality control measures such as data validation checks, data cleaning processes, and data reconciliation procedures, and has been regularly audited and reviewed for accuracy and completeness.",tables/Redfin1
"As a Compliance Officer at the organization owning the dataset, I can confirm that no ethical review processes, such as those conducted by an institutional review board, were conducted for this dataset. The dataset is a collection of real estate market statistics and does not involve human subjects or personal data. Therefore, there was no need for an ethical review process.","/*
Please provide the dataset of real estate market statistics mentioned in the previous response.",tables/Redfin1
"The dataset provided contains numerical values for various metrics related to the real estate market in different cities. There is no preprocessing/cleaning/labeling of the data done in the given dataset. The data is raw and requires further analysis and processing to make it suitable for machine learning or any other data analysis tasks. Some of the preprocessing steps that can be performed on this dataset are:

1. Handling missing values: There are some null values in the dataset, which need to be handled. One approach could be to fill the missing values with the mean or median of the respective columns.

2. Outlier detection and handling: The dataset may contain outliers that can significantly affect the analysis. Techniques like Z-score or IQR can be used to detect and handle outliers.

3. Data normalization: The dataset contains metrics with different scales, which can cause issues in machine learning algorithms. Normalization techniques like Min-Max scaling or Standardization can be used to bring all the metrics to a similar scale.

4. Feature engineering: Some of the features in the dataset can be engineered to create new features that can be more informative for the analysis. For example, the ""month-over-month change in ratio of properties sold above list price"" can be bucketed into categories like ""increasing,"" ""decreasing,"" or ""stable.""

5. Target variable creation: The dataset does not have a target variable that can be used for supervised learning tasks. A target variable can be created based on the business problem, for example, predicting the median sale price based on the given features.

6. Data splitting: The dataset can be split into training and testing sets to evaluate the performance of the machine learning models.

In summary, the dataset provided requires preprocessing, cleaning, and labeling before it can be used for machine learning or any other data analysis tasks.","/*
Please provide a dataset containing numerical values for various metrics related to the real estate market in different cities. The dataset does not have any preprocessing/cleaning/labeling done, and it requires further analysis and processing to make it suitable for machine learning or any other data analysis tasks. The dataset may contain missing values, outliers, and features with different scales. It does not have a target variable defined. Please provide the raw dataset as it is, without any preprocessing or cleaning done.",tables/Redfin1
