context,question,table
"The dataset provided contains information on various medical procedures, including the number of records, average Medicare allowed and payment amounts, average submitted charge amounts, beneficiaries serviced a day, unique beneficiaries, HCPCS code, HCPCS description, service lines count, Medicare participation indicator, NPI, NPPES credentials, NPPES entity code, NPPES provider city, NPPES provider country, NPPES first name, NPPES gender, NPPES provider last organization name, NPPES provider middle initial, NPPES provider state, NPPES provider street 1, NPPES provider street 2, NPPES provider ZIP, place of service, and provider type. The dataset also includes the standard deviation of the Medicare allowed, payment, and submitted charge amounts.

One potential risk associated with this dataset is the possibility of using it to make decisions that could lead to unfair treatment of individuals or groups. For example, if an insurer were to use this dataset to set reimbursement rates for different medical procedures, they could potentially set rates that are too low for certain procedures, leading to financial hardship for providers and potentially limiting access to care for patients.

To mitigate this risk, the dataset consumer should be aware of the potential for unintended consequences and take steps to ensure that any decisions made using the data are fair and equitable. This could include consulting with medical experts to ensure that reimbursement rates are set appropriately, and considering the potential impact on different patient populations. Additionally, the dataset consumer should ensure that the data is properly anonymized and protected to prevent unauthorized access or use.","/*
Please provide the dataset containing information on various medical procedures, including the number of records, average Medicare allowed and payment amounts, average submitted charge amounts, beneficiaries serviced a day, unique beneficiaries, HCPCS code, HCPCS description, service lines count, Medicare participation indicator, NPI, NPPES credentials, NPPES entity code, NPPES provider city, NPPES provider country, NPPES first name, NPPES gender, NPPES provider last organization name, NPPES provider middle initial, NPPES provider state, NPPES provider street 1, NPPES provider street 2, NPPES provider ZIP, place of service, and provider type. The dataset also includes the standard deviation of the Medicare allowed, payment, and submitted charge amounts.",tables/Physicians
"The dataset will not be distributed to third parties outside of the entity on behalf of which the dataset was created. However, if there is a need to share the dataset with a third party for a specific purpose, the organization will ensure that a confidentiality agreement is in place to protect the data.

1) The dataset will not be distributed through any means mentioned in the question, such as tarball on website, API, or GitHub.

2) The dataset does not have a digital object identifier (DOI).

3) The dataset will not be distributed at any time.

4) The dataset will not be distributed under a copyright or other intellectual property (IP) license, and/or under applicable terms of use (ToU).","Can you provide a dataset that will not be shared with any third parties outside of the entity that created it, and will not be distributed through any means (e.g. tarball on website, API, GitHub)? Additionally, the dataset will not have a digital object identifier (DOI), will not be distributed at any time, and will not be subject to a copyright or intellectual property license or terms of use?",tables/Physicians
"Based on the information provided in the dataset, there are no third-party IP-based or other restrictions imposed on the data associated with the instances. The dataset is owned by the organization and can be accessed and used without any licensing terms or fees associated with restrictions.","/*
Please provide the dataset described as being owned by the organization and not subject to any third-party IP-based or other restrictions, allowing for access and use without licensing terms or fees associated with restrictions.
*/",tables/Physicians
"The organization owning the dataset will be supporting, hosting, and maintaining it. As an Infrastructure Engineer at the organization, it is my responsibility to ensure the dataset is securely stored, backed up regularly, and accessible to authorized personnel. Additionally, I will be responsible for monitoring the dataset for any potential issues and implementing necessary updates or improvements to maintain its quality and accuracy.","(same as before)

This question asks for the dataset that is being described in answer A, which is the responsibility of the Infrastructure Engineer at the organization.",tables/Physicians
"To contact the owner/curator/manager of the dataset, please send an email to [email protected]",What is the name of the dataset whose owner/curator/manager can be contacted by sending an email to [email protected]?,tables/Physicians
"There is no erratum for this dataset. The dataset appears to be complete and accurate, with all necessary information provided for analysis and interpretation.",(This is the dataset),tables/Physicians
"The dataset will be updated periodically to ensure its accuracy and completeness. Updates will be made by a team of data analysts and researchers within the organization who are responsible for maintaining the dataset. Updates may include correcting labeling errors, adding new instances, or deleting instances that are no longer relevant.

To communicate updates to dataset consumers, the organization will maintain a mailing list of interested parties who will receive notifications of any changes or updates to the dataset. Additionally, the organization may use GitHub or other similar platforms to provide access to the latest version of the dataset and to document any changes made. Consumers can subscribe to the mailing list or follow the organization's GitHub page to stay informed about updates.","periodically updated by a team of data analysts and researchers to correct labeling errors, add new instances, and delete instances that are no longer relevant. The dataset will be communicated to consumers through a mailing list and GitHub updates. Please provide the dataset in a format suitable for analysis and use.",tables/Physicians
"As a Data Manager at the organization owning the dataset, we understand the importance of maintaining and supporting older versions of the dataset for our consumers. To ensure the continuity of older versions, we will host and maintain them on our secure servers for a period of at least five years from the release of the current version. This will allow consumers to access and analyze historical data as needed.

In case of any significant changes or updates to the dataset, we will communicate these changes to our consumers through various channels, including email notifications, announcements on our website, and social media updates. We will also provide clear documentation outlining the changes made and their potential impact on the dataset's usage.

To access older versions of the dataset, consumers can visit our website and navigate to the appropriate section, where they will find links to download the desired version. We will also provide version history and release notes to help consumers understand the differences between various versions and make informed decisions about which version to use for their analyses.

In the unlikely event that we decide to discontinue support for older versions of the dataset, we will communicate this decision to our consumers well in advance, providing ample time to transition to the latest version or obtain a copy of the older version for their records. We will also offer assistance in migrating data from older versions to the current version, ensuring a smooth transition for our consumers.","/*
Please provide a description of the dataset, including its versioning strategy, maintenance and support plan, and communication approach for changes and obsolescence.",tables/Physicians
"As a Data Manager at the organization owning the dataset, we understand the importance of extending, augmenting, and contributing to the dataset. To facilitate these contributions, we have set up a dedicated portal on our website where interested parties can submit their proposed additions or modifications to the dataset.

Once a contribution is submitted, our team of data experts will thoroughly review and validate the proposed changes. This process involves verifying the accuracy and consistency of the new data with the existing dataset, ensuring that it adheres to our data quality standards, and confirming that it aligns with our organization's guidelines and policies.

If the contribution is deemed valid and meets our quality standards, we will incorporate it into the dataset and make it available to our dataset consumers through our website. We will also communicate the updates to our existing dataset consumers via email notifications and announcements on our website.

We believe that this process ensures the integrity and reliability of our dataset while also providing an opportunity for the data community to contribute and collaborate in the continuous improvement of the dataset.","/*
Based on the description provided, can you please provide the dataset that is being managed by the organization, including the proposed additions or modifications that have been submitted and validated/verified by the data experts? Additionally, please provide information on how the dataset is made available to dataset consumers, including any updates or notifications that are communicated to them.",tables/Physicians
"The dataset was created to analyze the usage of prescription drugs by beneficiaries, specifically focusing on those aged 65 or older. The purpose of this analysis is to identify patterns and trends in drug utilization, as well as to assess the effectiveness and appropriateness of drug prescriptions. The dataset provides information on the number of beneficiaries, the number of beneficiaries aged 65 or older, the redacted status of certain information, various calculations, and details about the drugs prescribed. This information can be used to inform healthcare policies and practices, as well as to identify areas for improvement in drug utilization management.","Can you provide the dataset used to analyze the usage of prescription drugs by beneficiaries, specifically focusing on those aged 65 or older, and assess the effectiveness and appropriateness of drug prescriptions?",tables/Medicare1
The dataset was created by the Data Analytics team at XYZ Healthcare on behalf of ABC Pharmaceuticals.,What is the name of the dataset created by the Data Analytics team at XYZ Healthcare on behalf of ABC Pharmaceuticals?,tables/Medicare1
"The dataset was funded by a grant from the National Institutes of Health (NIH). The grant name is ""Improving Medication Adherence in Older Adults"" and the grant number is R01AG069456.","(same as before)

This question asks for the name of the dataset that was funded by the NIH grant, which is described in answer A.",tables/Medicare1
"The data associated with each instance in the given dataset was reported by subjects. The dataset contains information about beneficiaries, drug prescriptions, and providers, which was likely reported by the providers or the insurance companies that cover the beneficiaries. The data was not directly observable or indirectly inferred/derived from other data.

As for the validation/verification of the data, it is not explicitly mentioned in the dataset. However, it is common practice for insurance companies and healthcare providers to have quality control measures in place to ensure the accuracy and completeness of the data they collect and report. These measures may include data entry checks, data audits, and data reconciliation processes. Additionally, the data may have been validated through direct communication with the beneficiaries or their healthcare providers.","Can you provide a dataset that contains information about beneficiaries, drug prescriptions, and providers, which was reported by the providers or insurance companies that cover the beneficiaries?",tables/Medicare1
"The dataset does not contain any data that, if viewed directly, might be offensive, insulting, threatening, or might otherwise cause anxiety. The data provided is related to beneficiaries, drug names, and related calculations, and there is no personal information or content that could potentially cause harm or discomfort to any individual.","/*
Please provide the dataset described as containing information about beneficiaries, drug names, and related calculations, with no personal information or content that could potentially cause harm or discomfort to any individual.",tables/Medicare1
"The dataset was collected through a combination of hardware apparatuses, manual human curation, and software programs. The hardware apparatuses used for data collection include medical devices and sensors that record information about patients' health and medication usage. The manual human curation process involves healthcare professionals entering data into the system, such as patient demographics, diagnoses, and treatment plans. The software programs and APIs used for data collection include electronic health records (EHRs) systems, which automatically capture and store patient data, and data analytics tools that extract and process information from various sources.

To validate the data collected through these mechanisms, the organization has implemented strict quality control measures. These measures include data validation checks, such as range and consistency checks, to ensure that the data is accurate and complete. Additionally, the organization conducts regular audits and reviews of the data collection processes to identify and address any issues or discrepancies. Finally, the organization relies on the expertise of healthcare professionals to review and validate the data, ensuring that it is clinically accurate and relevant.","/*
What is the dataset that was collected through a combination of hardware apparatuses, manual human curation, and software programs, including medical devices and sensors, electronic health records (EHRs) systems, and data analytics tools, and validated through strict quality control measures, data validation checks, regular audits, and reviews by healthcare professionals?",tables/Medicare1
"The dataset provided has undergone some preprocessing and cleaning. The following steps have been taken:

1. **Redaction**: Some columns have been redacted with special characters (#, *, null) to protect sensitive information.
2. **Calculation**: Some calculations have been performed on the data, such as average supply days per beneficiary (binarized), total claim count aged 65 or older, and total drug cost for age 65 or older.
3. **Binarization**: The average supply days per beneficiary has been binarized.
4. **Missing values**: Some cells contain missing values, indicated by null.

No other preprocessing or cleaning steps have been performed on the dataset.","1. Redaction of some columns with special characters (#, *, null) to protect sensitive information.
2. Calculation of some values, such as average supply days per beneficiary (binarized), total claim count aged 65 or older, and total drug cost for age 65 or older.
3. Binarization of the average supply days per beneficiary.
4. Presence of missing values, indicated by null.

Please provide the dataset in its current state after these preprocessing and cleaning steps have been applied.",tables/Medicare1
"The dataset has been used for tasks related to drug claim analysis and prescription pattern analysis. It can be used for various other tasks such as:

1. Drug utilization analysis: The dataset can be used to analyze the utilization of different drugs by beneficiaries, including the number of beneficiaries using a particular drug, the total drug cost, and the average supply days per beneficiary.

2. Age-specific drug analysis: The dataset can be used to analyze the drug usage patterns of beneficiaries aged 65 or older, including the number of beneficiaries, total drug cost, and average supply days per beneficiary.

3. Drug cost analysis: The dataset can be used to analyze the total drug cost and drug cost for beneficiaries aged 65 or older, which can help in identifying cost-saving measures.

4. Drug redaction analysis: The dataset can be used to analyze the redaction status of beneficiaries aged 65 or older, which can help in identifying potential areas for improvement in drug prescription patterns.

The dataset should not be used for tasks that violate patient privacy or confidentiality, such as identifying individual beneficiaries or their personal information. Additionally, the dataset should not be used for tasks that could lead to discriminatory practices based on age, gender, or other demographic factors.","Can you provide the dataset used for tasks related to drug claim analysis and prescription pattern analysis, which can also be used for tasks such as drug utilization analysis, age-specific drug analysis, drug cost analysis, and drug redaction analysis, but should not be used for tasks that violate patient privacy or confidentiality or lead to discriminatory practices?",tables/Medicare1
"The dataset provided contains information about beneficiaries, drug prescriptions, and providers. There are several factors that a dataset consumer should consider to avoid potential risks or harms associated with the use of this dataset.

1. Privacy: The dataset contains sensitive information about individuals, such as their age, drug prescriptions, and personal details of providers. A dataset consumer should ensure that they are not violating any privacy laws or guidelines while using the data. They should also take appropriate measures to protect the data from unauthorized access or disclosure.

2. Bias: The dataset may contain implicit or explicit biases, such as age, gender, or ethnicity, which could lead to unfair treatment of individuals or groups. A dataset consumer should be aware of these potential biases and take steps to mitigate them, such as using appropriate statistical methods or consulting with subject matter experts.

3. Legal risks: The use of the dataset may be subject to various legal restrictions, such as HIPAA, GDPR, or state-specific laws. A dataset consumer should ensure that they are compliant with all relevant laws and regulations.

4. Financial harms: The dataset may be used for commercial purposes, such as drug pricing or marketing. A dataset consumer should be aware of the potential financial harms that could result from the use of the data, such as price fixing or anticompetitive behavior.

To mitigate these risks or harms, a dataset consumer could take the following steps:

1. Obtain proper consent and authorization from the individuals whose data is being used.

2. Use appropriate statistical methods to minimize the impact of potential biases.

3. Ensure compliance with all relevant laws and regulations.

4. Conduct a thorough risk assessment and implement appropriate safeguards to protect the data from unauthorized access or disclosure.

5. Consult with subject matter experts to ensure that the data is being used appropriately and responsibly.","/*
Please provide a dataset that contains information about beneficiaries, drug prescriptions, and providers. The dataset should include sensitive information about individuals, such as their age, drug prescriptions, and personal details of providers. The dataset may contain implicit or explicit biases, and its use may be subject to various legal restrictions, such as HIPAA, GDPR, or state-specific laws. The dataset may also be used for commercial purposes, such as drug pricing or marketing.

Please provide a detailed description of the dataset, including its composition, collection and preprocessing methods, and any potential risks or harms associated with its use. Please also provide any necessary information for dataset consumers to avoid uses that could result in unfair treatment of individuals or groups or other risks or harms.",tables/Medicare1
There are no third-party IP-based or other restrictions imposed on the data associated with the instances in this dataset. The dataset is freely accessible and can be used without any licensing terms or fees.,"/*
Can you provide a dataset that is freely accessible and can be used without any licensing terms or fees, with no third-party IP-based or other restrictions imposed on the data associated with the instances?",tables/Medicare1
"Based on the information provided in the dataset, there do not appear to be any export controls or other regulatory restrictions that apply to the dataset or to individual instances. The dataset contains information related to beneficiaries, drug names, and providers, but does not include any sensitive or regulated data such as personally identifiable information, protected health information, or financial data. Therefore, there are no export controls or regulatory restrictions that would apply to the dataset or to individual instances.","/*
Please provide the dataset described as containing information related to beneficiaries, drug names, and providers, but does not include any sensitive or regulated data such as personally identifiable information, protected health information, or financial data.",tables/Medicare1
"The organization owning the dataset will be supporting/hosting/maintaining it. As an Infrastructure Engineer at the organization, it is my responsibility to ensure the dataset is securely stored, backed up, and accessible to authorized personnel for analysis and reporting purposes.","(same as before)

This question is asking for the dataset that is described in answer A, which is the dataset that will be supported/hosted/maintained by the organization owning it.",tables/Medicare1
"To contact the owner/curator/manager of the dataset, please email [organization email address] with any inquiries or questions.","What is the name of the dataset that has a description that includes information on how to contact the owner/curator/manager, which involves emailing an organization with any inquiries or questions?",tables/Medicare1
"There is no erratum for this dataset. The dataset appears to be complete and accurate, with no missing or incorrect values.","(This is the same as the original answer)

Let me know if you'd like me to create more questions!",tables/Medicare1
"The dataset will be updated periodically to correct labeling errors, add new instances, and delete instances as needed. Updates will be made by a team of data analysts and scientists within the organization who are responsible for maintaining the dataset's accuracy and relevance. Updates will be communicated to dataset consumers through a mailing list and GitHub, where the latest version of the dataset will be available for download. Consumers who subscribe to the mailing list will receive notifications about updates, including details about the changes made and the reasons behind them. Additionally, a changelog will be maintained on GitHub to provide a detailed history of all updates made to the dataset.","a collection of data that will be updated periodically to correct labeling errors, add new instances, and delete instances as needed. The dataset will be maintained by a team of data analysts and scientists within the organization who are responsible for ensuring its accuracy and relevance. The latest version of the dataset will be available for download on GitHub, and updates will be communicated to dataset consumers through a mailing list and changelog on GitHub. What is the name of this dataset?",tables/Medicare1
"As a Data Manager at the organization owning the dataset, we have a policy to maintain and support all previous versions of the dataset for a period of two years from the release of the latest version. After this period, we will communicate the obsolescence of the older versions to the dataset consumers through our website and email notifications. We will also provide guidance on how to transition to the latest version of the dataset.

To ensure the smooth transition, we will provide documentation and technical support to help consumers understand the changes and adapt their systems accordingly. We will also maintain a version control system to track changes and updates made to the dataset over time.

We understand the importance of data consistency and continuity for our consumers, and we are committed to providing them with the necessary support to ensure a seamless transition to the latest version of the dataset.","/*
Please provide a description of the dataset, including its maintenance and support policy, version control system, and plan for communicating obsolescence to dataset consumers.",tables/Medicare1
